0000:00:00.0 RAM memory: Broadcom Corporation: Unknown device 0803
	Control: I/O- Mem- BusMaster- SpecCycle- MemWINV- VGASnoop- ParErr- Stepping- SERR- FastB2B-
	Status: Cap- 66MHz- UDF- FastB2B- ParErr- DEVSEL=fast >TAbort- <TAbort- <MAbort- >SERR- <PERR-
	Interrupt: pin ? routed to IRQ 6
	Region 0: Memory at 18000000 (32-bit, non-prefetchable) [disabled] [size=4K]
	Region 1: Memory at <unassigned> (32-bit, non-prefetchable) [disabled] [size=128M]
	Region 2: Memory at 10000000 (32-bit, non-prefetchable) [disabled] [size=128M]
	Region 3: Memory at 80000000 (32-bit, non-prefetchable) [disabled] [size=80000000]
	Expansion ROM at <unassigned> [disabled] [size=2K]

0000:00:01.0 Ethernet controller: Broadcom Corporation BCM47xx Sentry5 iLine32 HomePNA 2.0
	Control: I/O- Mem- BusMaster- SpecCycle- MemWINV- VGASnoop- ParErr- Stepping- SERR- FastB2B-
	Status: Cap- 66MHz- UDF- FastB2B- ParErr- DEVSEL=fast >TAbort- <TAbort- <MAbort- >SERR- <PERR-
	Interrupt: pin B routed to IRQ 5
	Region 0: Memory at 18001000 (32-bit, non-prefetchable) [disabled] [size=4K]
	Expansion ROM at <unassigned> [disabled] [size=2K]

0000:00:02.0 Ethernet controller: Broadcom Corporation Sentry5 Ethernet Controller
	Control: I/O- Mem- BusMaster+ SpecCycle- MemWINV- VGASnoop- ParErr- Stepping- SERR- FastB2B-
	Status: Cap- 66MHz- UDF- FastB2B- ParErr- DEVSEL=fast >TAbort- <TAbort- <MAbort- >SERR- <PERR-
	Latency: 64
	Interrupt: pin A routed to IRQ 3
	Region 0: Memory at 18002000 (32-bit, non-prefetchable) [disabled] [size=4K]
	Expansion ROM at <unassigned> [disabled] [size=2K]

0000:00:03.0 Modem: Broadcom Corporation Sentry5 UART (prog-if 00 [Generic])
	Control: I/O- Mem- BusMaster- SpecCycle- MemWINV- VGASnoop- ParErr- Stepping- SERR- FastB2B-
	Status: Cap- 66MHz- UDF- FastB2B- ParErr- DEVSEL=fast >TAbort- <TAbort- <MAbort- >SERR- <PERR-
	Interrupt: pin C routed to IRQ 2
	Region 0: Memory at 18003000 (32-bit, non-prefetchable) [disabled] [size=4K]
	Expansion ROM at <unassigned> [disabled] [size=2K]

0000:00:04.0 USB Controller: Broadcom Corporation Sentry5 USB Controller (prog-if 10 [OHCI])
	Control: I/O- Mem- BusMaster- SpecCycle- MemWINV- VGASnoop- ParErr- Stepping- SERR- FastB2B-
	Status: Cap- 66MHz- UDF- FastB2B- ParErr- DEVSEL=fast >TAbort- <TAbort- <MAbort- >SERR- <PERR-
	Interrupt: pin D routed to IRQ 2
	Region 0: Memory at 18004000 (32-bit, non-prefetchable) [disabled] [size=4K]
	Expansion ROM at <unassigned> [disabled] [size=2K]

0000:00:05.0 PCI bridge: Broadcom Corporation Sentry5 PCI Bridge (prog-if 00 [Normal decode])
	Control: I/O- Mem- BusMaster- SpecCycle- MemWINV- VGASnoop- ParErr- Stepping- SERR- FastB2B-
	Status: Cap+ 66MHz+ UDF+ FastB2B+ ParErr+ DEVSEL=?? >TAbort+ <TAbort+ <MAbort+ >SERR+ <PERR+
	Region 0: Memory at 18005000 (32-bit, non-prefetchable) [disabled] [size=4K]
	Region 1: Memory at 08000000 (32-bit, non-prefetchable) [disabled] [size=128M]
	Bus: primary=00, secondary=01, subordinate=01, sec-latency=64
	I/O behind bridge: 00000000-00000fff
	Memory behind bridge: 00000000-000fffff
	Prefetchable memory behind bridge: 00000000-000fffff
	Expansion ROM at <unassigned> [disabled] [size=2K]
	BridgeCtl: Parity- SERR- NoISA- VGA- MAbort- >Reset- FastB2B-

0000:00:06.0 MIPS: Broadcom Corporation Sentry5 MIPS32 CPU
	Control: I/O- Mem- BusMaster- SpecCycle- MemWINV- VGASnoop- ParErr- Stepping- SERR- FastB2B-
	Status: Cap- 66MHz- UDF- FastB2B- ParErr- DEVSEL=fast >TAbort- <TAbort- <MAbort- >SERR- <PERR-
	Interrupt: pin ? routed to IRQ 6
	Region 0: Memory at 18006000 (32-bit, non-prefetchable) [disabled] [size=4K]
	Region 1: Memory at ff200000 (32-bit, non-prefetchable) [disabled] [size=2M]
	Expansion ROM at <unassigned> [disabled] [size=2K]

0000:00:07.0 FLASH memory: Broadcom Corporation Sentry5 External Interface Core
	Control: I/O- Mem- BusMaster- SpecCycle- MemWINV- VGASnoop- ParErr- Stepping- SERR- FastB2B-
	Status: Cap- 66MHz- UDF- FastB2B- ParErr- DEVSEL=fast >TAbort- <TAbort- <MAbort- >SERR- <PERR-
	Interrupt: pin E routed to IRQ 2
	Region 0: Memory at 18007000 (32-bit, non-prefetchable) [disabled] [size=4K]
	Region 1: Memory at 1f000000 (32-bit, non-prefetchable) [disabled] [size=16M]
	Expansion ROM at <unassigned> [disabled] [size=2K]

0000:00:08.0 Ethernet controller: Broadcom Corporation Sentry5 Ethernet Controller
	Control: I/O- Mem- BusMaster+ SpecCycle- MemWINV- VGASnoop- ParErr- Stepping- SERR- FastB2B-
	Status: Cap- 66MHz- UDF- FastB2B- ParErr- DEVSEL=fast >TAbort- <TAbort- <MAbort- >SERR- <PERR-
	Latency: 64
	Interrupt: pin F routed to IRQ 4
	Region 0: Memory at 18008000 (32-bit, non-prefetchable) [disabled] [size=4K]
	Expansion ROM at <unassigned> [disabled] [size=2K]

0000:01:00.0 Host bridge: Broadcom Corporation BCM4710 Sentry5 PCI to SB Bridge (rev 01)
	Subsystem: Broadcom Corporation BCM4710 Sentry5 PCI to SB Bridge
	Control: I/O- Mem+ BusMaster+ SpecCycle- MemWINV- VGASnoop- ParErr- Stepping- SERR- FastB2B-
	Status: Cap- 66MHz- UDF- FastB2B- ParErr- DEVSEL=fast >TAbort- <TAbort- <MAbort+ >SERR- <PERR-
	Latency: 64
	Interrupt: pin A routed to IRQ 6
	Region 0: Memory at 40000000 (32-bit, non-prefetchable) [size=8K]
	Region 1: Memory at <unassigned> (32-bit, prefetchable) [size=128M]

0000:01:08.0 Network controller: Broadcom Corporation BCM4306 802.11b/g Wireless LAN Controller (rev 03)
	Subsystem: Tekram Technology Co.,Ltd.: Unknown device 1603
	Control: I/O- Mem+ BusMaster+ SpecCycle- MemWINV- VGASnoop- ParErr- Stepping- SERR- FastB2B-
	Status: Cap- 66MHz- UDF- FastB2B- ParErr- DEVSEL=fast >TAbort- <TAbort- <MAbort- >SERR- <PERR-
	Latency: 64
	Interrupt: pin A routed to IRQ 6
	Region 0: Memory at 40002000 (32-bit, non-prefetchable) [size=8K]

