00:00.0 Class 0200: 168c:001b (rev 01)
        Subsystem: 168c:2063
        Control: I/O- Mem+ BusMaster+ SpecCycle- MemWINV- VGASnoop- ParErr-
Stepping- SERR- FastB2B-
        Status: Cap+ 66Mhz- UDF- FastB2B+ ParErr- DEVSEL=medium >TAbort-
<TAbort- <MAbort- >SERR- <PERR-
        Latency: 128 (2500ns min, 7000ns max)
        Interrupt: pin A routed to IRQ 1
        Region 0: Memory at 40000000 (32-bit, non-prefetchable) [size=64K]
        Capabilities: [44] Power Management version 2
                Flags: PMEClk- DSI- D1- D2- AuxCurrent=375mA
PME(D0-,D1-,D2-,D3hot-,D3cold-)
                Status: D0 PME-Enable- DSel=0 DScale=2 PME-

00:01.0 Class 0200: 168c:001b (rev 01)
        Subsystem: 168c:2063
        Control: I/O- Mem+ BusMaster+ SpecCycle- MemWINV- VGASnoop- ParErr-
Stepping- SERR- FastB2B-
        Status: Cap+ 66Mhz- UDF- FastB2B+ ParErr- DEVSEL=medium >TAbort-
<TAbort- <MAbort- >SERR- <PERR-
        Latency: 128 (2500ns min, 7000ns max)
        Interrupt: pin A routed to IRQ 2
        Region 0: Memory at 40010000 (32-bit, non-prefetchable) [size=64K]
        Capabilities: [44] Power Management version 2
                Flags: PMEClk- DSI- D1- D2- AuxCurrent=375mA
PME(D0-,D1-,D2-,D3hot-,D3cold-)
                Status: D0 PME-Enable- DSel=0 DScale=2 PME-

